ID,type,http__www_w3_org_2004_02_skos_core_prefLabel,http__www_w3_org_1999_02_22-rdf-syntax-ns_type,http__purl_org_dc_terms_description,http__www_w3_org_2004_02_skos_core_inScheme,http__www_w3_org_2004_02_skos_core_member,http__www_w3_org_2004_02_skos_core_definition
https://aphia.org/ns/traits/habitats_directive_annex#,collection,,,Council Directive 92/43/EEC of 21 May 1992 on the conservation of natural habitats and of wild fauna and flora.,,https://aphia.org/ns/traits/habitats_directive_annex#habitats_directive_annex_V,
https://aphia.org/ns/traits/habitats_directive_annex#habitats_directive_annex_II,concept,Habitats Directive Annex II,https://aphia.org/ns/attribute-trait/Trait,,https://aphia.org/ns/traits/,,Animal and plant species of community interest whose conservation requires the designation of special areas of conservation.
https://aphia.org/ns/traits/habitats_directive_annex#habitats_directive_annex_III,concept,Habitats Directive Annex III,https://aphia.org/ns/attribute-trait/Trait,,https://aphia.org/ns/traits/,,Criteria for selecting sites eligible for identification as sites of community importance and designation as specieal areas of conservation.
https://aphia.org/ns/traits/habitats_directive_annex#habitats_directive_annex_V,concept,Habitats Directive Annex V,https://aphia.org/ns/attribute-trait/Trait,,https://aphia.org/ns/traits/,,Animal and plant species of community interest whose taking in the wild and exploitation may be subject to management measures.
https://aphia.org/ns/traits/habitats_directive_annex#habitats_directive_annex_VI,concept,Habitats Directive Annex VI,https://aphia.org/ns/attribute-trait/Trait,,https://aphia.org/ns/traits/,,Prohibited methods and means of capture and killing and modes of transport.
https://aphia.org/ns/traits/habitats_directive_annex#habitats_directive_annex_IV,concept,Habitats Directive Annex IV,https://aphia.org/ns/attribute-trait/Trait,,https://aphia.org/ns/traits/,,Animal and plant species of comminity interest in need of strict protection.
https://aphia.org/ns/traits/habitats_directive_annex#habitats_directive_annex_I,concept,Habitats Directive Annex I,https://aphia.org/ns/attribute-trait/Trait,,https://aphia.org/ns/traits/,,Natural habitat types of community interest whose conservation requires the designation of specia areas of conservation.
