ID,type,http__www_w3_org_2004_02_skos_core_member,http__www_w3_org_2004_02_skos_core_prefLabel,http__www_w3_org_1999_02_22-rdf-syntax-ns_type,http__www_w3_org_2004_02_skos_core_definition,http__purl_org_dc_terms_description,http__www_w3_org_2004_02_skos_core_inScheme
https://aphia.org/ns/traits/supporting_structure_enclosure#,collection,https://aphia.org/ns/traits/supporting_structure_enclosure#exoskeleton,,,,"Hard framework, internal or external, which supports and protects softer parts of plant, animal or unicellular organism, and to which muscles usually attach in animals, includes skeletons (derived from Lawrence, 2005).",
https://aphia.org/ns/traits/supporting_structure_enclosure#unsupported,concept,,unsupported,https://aphia.org/ns/attribute-trait/Trait,"The organism has no supporting structures and enclosures; no skeleton (derived from Lawrence 2005 - Henderson's Dictionary of Biology, and discussed and agreed upon by the WoRMS/Aphia editor community).",,https://aphia.org/ns/traits/
https://aphia.org/ns/traits/supporting_structure_enclosure#hydrostatic_skeleton,concept,,hydrostatic skeleton,https://aphia.org/ns/attribute-trait/Trait,"Skeletal support provided by hydrostatic pressure from a fluid filled cavity (e.g. the coelum) surrounded by muscles. Hydrostatic pressure provides skeletal support in sea anemones, jellyfish, nematodes, annelids, echinoderms, and other groups (derived from Lawrence, 2005 - Henderson's Dictionary of Biology, and discussed and agreed upon by the WoRMS/Aphia editor community).",,https://aphia.org/ns/traits/
https://aphia.org/ns/traits/supporting_structure_enclosure#external_tube,concept,,external tube,https://aphia.org/ns/attribute-trait/Trait,"A built-structure inhabited by an organism and essential to its survival, but not part of its body, composed of hardened (either rigid or flexible) secretions, with or without the addition of embedded particles, with those particles either selectively collected from the environment or passively becoming glued during formation (pers. comm. Read, G.).",,https://aphia.org/ns/traits/
https://aphia.org/ns/traits/supporting_structure_enclosure#exoskeleton,concept,,exoskeleton (including shells),https://aphia.org/ns/attribute-trait/Trait,"A rigid external structure that supports and/or protects the body of an organism and that is mainly completely secreted by the epidermis (derived from Lawrence 2005 - Henderson's Dictionary of Biology, and discussed and agreed upon by the WoRMS/Aphia editor community).",,https://aphia.org/ns/traits/
https://aphia.org/ns/traits/supporting_structure_enclosure#endoskeleton,concept,,endoskeleton,https://aphia.org/ns/attribute-trait/Trait,"Any internal skeleton or supporting structure (derived from Lawrence 2005 - Henderson's Dictionary of Biology, and discussed and agreed upon by the WoRMS/Aphia editor community).",,https://aphia.org/ns/traits/
